{
  "created_at": "2026-04-17T10:00:00Z",
  "git_sha": "abc123def456",
  "coverage": {
    "python": 0.85,
    "bash": 0.72
  },
  "findings_count": {
    "shellcheck": 5,
    "ruff": 0
  },
  "tool_versions": {
    "shellcheck": "0.9.0",
    "ruff": "0.5.1"
  },
  "deferred_findings_ref": "docs/grinder/deferred-findings.json"
}
